repo_name,language,description
.github,,Default Community Health/Policy Files for the Microsoft organization on GitHub
.Net-Interactive-Kernels-ADS,Jupyter Notebook,Install and Use .Net Interactive Kernels in ADS
.NET-Modernization-In-a-Day,JavaScript,.NET Modernization In a Day workshop content
0xDeCA10B,Python,Sharing Updatable Models (SUM) on Blockchain
2019-ignite-circuit-playground,Python,Get started with Circuit Playground Express and the Device Simulator Express
2023iotlevelup,Python,
25-days-of-serverless,,Repository responsible for 25 days of Serverless challenges
2LCS,C#,Lifecycle Services Companion App for administrators
3-in-1-dock,,
30daysof,JavaScript,"30 Day of Learning Resources, Samples and Curricula"
3DTelecommunications,C++,3D Telecommunications project utilizing Holoportation technology to provide live volumetric capture.  Used in one case to increase the reach of specialized medicine.
50BusinessAssignmentsLog,,Dataset containing an Event Log of 165 recordings of 50 business assignments.
A-CLIP,Python,"Official Implementation of Attentive Mask CLIP (ICCV2023, https://arxiv.org/abs/2212.08653)"
A-TALE-OF-THREE-CITIES,R,"Analyzing the safety (311) dataset published by Azure Open Datasets for Chicago, Boston and New York City using SparkR, SParkSQL, Azure Databricks, visualization using ggplot2 and leaflet. Focus is on descriptive analytics, visualization, clustering, time series forecasting and anomaly detection."
a11y-llm-eval,Python,An eval tool to benchmark how well LLMs generate accessible HTML
a11y-llm-eval-report,,
aaai21-copy-that,Python,"Source code for the ""Copy that! Editing Sequences by Copying Spans"" AAAI'21 paper"
aad-app-credential-tools,PowerShell,Tooling for application credentials
aad-hybrid-lab,PowerShell,"Create a new VM with AD installed, test users created, PowerShell Azure AD modules, and Azure AD Connect installer ready to go."
AADB2C-migration,,
aadb2c-starter-kit,JavaScript,
AADConnectConfigDocumenter,C#,AAD Connect configuration documenter is a tool to generate documentation of an AAD Connect installation.
aad_b2c_webview,Dart,Azure AD B2C Embedded Webview is a very simple Flutter package that demonstrates how to use the embedded web view to sign in users with Azure AD B2C.
aaq,,Code and Data artifact for Affective Air Quality: A Dataset of Gas Sensor Data during Emotional Experiences
AaronLocker,PowerShell,Robust and practical application control for Windows
ABAP-SDK-for-Azure,ABAP,ABAP Libraries for SAP native Integration with Azure Services
abap2git,ABAP,"One-way sync from SAP to Git repo for ABAP objects allowing multiple systems in branches and multiple packages in one branch, supporting code objects plus configuration delta and HR/payroll PCR/schema"
ability-attributes,TypeScript,Web Application Accessibility Attributes Runtime Validator
abledom,TypeScript,Continuous detection of typical web application accessibility problems.
ABS-CSA-Assets,JavaScript,This repo centralizes assets used by Microsoft CSAs. It is available to all organizations for educational purposes.
abskorea,Shell,Korea STU ABS Team Blog
abstrakt,Go,"Business oriented, config driven DevOps"
aca-dev-day,JavaScript,Documentation and Workshop steps for Azure Container Apps Dev Day
academic-knowledge-exploration-services-utilities,PowerShell,Utility tools and scripts for interacting with Microsoft Academic Knowledge Exploration Service (MAKES)
AcademicContent,,"Free tech resources for faculty, students, researchers, life-long learners, and academic community builders for use in tech based courses, workshops, and hackathons."
acc,Bicep,Apps Command Center Accelerator
acc-vm-engine,Go,ACC VM template generator
accbpg,Jupyter Notebook,Accelerated Bregman Proximal Gradient Methods
AccCheckerExtensionForVS,C#,Detect and resolve common accessibility issues before you ship your code with a free Visual Studio extension.
accelerated-dft,Jupyter Notebook,Repository to host supporting information and code samples for Accelerated DFT
acceleratoRs,HTML,"Data science and AI solution accelerator suite that provides templates for prototyping, reporting, and presenting data science analytics of specific domains"
Accera,C++,"Open source cross-platform compiler for compute-intensive loops used in AI algorithms, from Microsoft Research"
access-reviews-samples,PowerShell,"This repo contains sample code that demonstrates programmatic access to Azure AD Access Reviews. Sample code includes reading and managing Access Reviews, as well as working on decisions and results of Access Reviews."
accessibility-announcer,TypeScript,A tool to provide the screen reader announcements on the web.
accessibility-insights-action,TypeScript,Github Action to scan for accessibility issues in github pages
accessibility-insights-for-android-service,Java,Accessibility Insights for Android service
accessibility-insights-service,TypeScript,Accessibility Insights Service
accessibility-insights-web,TypeScript,Accessibility Insights for Web
accessibility-insights-windows,C#,Accessibility Insights for Windows
Accessible-Connect,TypeScript,Accessible videoconferencing platform focusing on DHH (Deaf and Hard of Hearing).
AccessorFramework,C++,A C++ SDK for building cyber-physical applications using the Accessor Model
AccountGuard,PowerShell,Security ARM Templates for AccountGuard Enrollees 
ace,Objective-C++,Build Cordova apps with true native UI
ace-ux-components,TypeScript,
acon,Python,"Official implementation of paper ""ACON: Optimizing Context Compression for Long-horizon LLM Agents"""
acoustic-bird-detection,Jupyter Notebook,Machine learning tools for acoustic bird detection
Acoustic-Perception-for-Virtual-AI-Agents,C++,"This repository contains source code demonstrating the techniques discussed in the associated paper, ""Efficient Acoustic Perception for Virtual AI Agents"""
AcousticScatteringData,MATLAB,Synthetic exterior acoustic scattering data and sample parsing code.
acr,,"Azure Container Registry samples, troubleshooting tips and references"
acs-kitchen-sink,TypeScript,Demonstrating different Azure Communication Services features
act,Python,AML Command Transfer. A lightweight tool to transfer any command line to Azure Machine Learning Services
action-armttk,Shell,Github Action for running ARM-TTK
action-publish-symbols,TypeScript,GitHub Action to publish symbols to the Azure DevOps Package Management symbol server (Artifacts server).
action-python,,
activate-sensorcore,C#,Helper library for SensorCore SDK to activate Location and Motion data
ActivateAzurewithDevOps,HTML,
ActiveDirectoryDSC.Reverse,PowerShell,ReverseDSC Orchestrator for ActiveDirectory
activities,C#,Lumia SensorCore SDK sample for Activity Monitor API.
activity-log-export-automation,PowerShell,Connect Splunk to Azure Activity Log via PowerShell automation
ACV,Jupyter Notebook,A series of work towards achieving ACV.
acx-ado-automation,Python,
acxengineeringxp_2,,
ada,C++,Source code behind the Microsoft Research project Ada
ADAF,Python,"This repository contains the code used for ""ADAF: An Artificial Intelligence Data Assimilation Framework for Weather Forecasting"""
AdaM,,
AdaMix,Python,This is the implementation of the paper AdaMix: Mixture-of-Adaptations for Parameter-efficient Model Tuning (https://arxiv.org/abs/2205.12410). 
Adaptable,Java,"A tightly optimized representation of ordered, long-living, often-modified, predicate-filtered lists random-accessible by value and index. (Java)"
adaptive-testing,Jupyter Notebook,Find and fix bugs in natural language machine learning models using adaptive testing.
AdaptiveCards,C#,A new way for developers to exchange card content in a common and consistent way.
AdaptiveCards-.NET,C#,
adaptivecards-templates,TypeScript,A collection of Adaptive Card templates for well-known data models
adaptive_cloud_community,,Public repository for hosting the Azure Adaptive Cloud Community content
adb2spark,,
ADBench,C++,Benchmarking various AD tools.
adcs-proxy-exit-module,C++,Exit Module for Active Directory Certificate Services that proxies calls to external programs.
AddingSpeechToBots,C#,Adding Speech to Conversational Bots
AddOutlookJapanHoliday,VBScript,VBScript for adding Japan new Holidays to Outlook.
Addressing-signal-delay-in-deep-RL,Python,Addressing Signal Delay in Deep Reinforcement Learning
adfs-sample-block-user-on-adfs-marked-risky-by-AzureAD-IdentityProtection,C#,A sample AD FS 2019 Risk Assessment Model plug-in that blocks authentication or enforces MFA based on user risk level determined by Azure AD Identity Protection. 
adfs-sample-msal-dotnet-native-to-webapi,C#,A sample showcasing how to build a native app signing-in users authenticated by AD FS 2019 and acquiring tokens using MSAL library to call Web API.
adfs-sample-msal-dotnet-webapi-to-webapi-onbehalfof,C#,A sample showcasing how to implement an on-behalf-of (OBO) authentication using AD FS. The sample uses MSAL client library to obtain a token for accessing Web API. 
adfs-sample-RiskAssessmentModel-RiskyIPBlock,C#,Sample plug-in to block authentication requests coming from specified extranet IPs. 
adfsAuthAdapters,C#,External authentication adapters for AD FS
adfsLogTools,,"Tools for parsing AD FS logs (admin events, audits, and debug logs)"
adfsManagementTools,,A collection of scripts and tools for managing ADFS
adfsOpenSource,,Documentation and guidance for ADFS Open Source
adfsToolbox,PowerShell,A collection of PowerShell scripts for managing AD FS
adfsUITesting,C#,Testing infrastructure for automated browser testing against AD FS
adfsWebCustomization,JavaScript,A repository of useful Web Customizations for Active Directory Federation Services 
ADLaM-Display,Makefile,"A display font for the ADLaM script, which is an indigenous writing system for some West African languages."
adme-samples,HTML,
admin-torch,Python,Understanding the Difficulty of Training Transformers
ado-codespaces-auth,TypeScript,
ado-ml-batch-train,Jupyter Notebook,
ado-npm-auth,TypeScript,This package can automatically use the azureauth CLI to fetch tokens and update a user's .npmrc file for authenticating to Azure DevOps npm feeds.
ads-extension-telemetry,TypeScript,
ads-kerberos,C++,A package for providing kerberos authentication support in Azure Data Studio. 
ads-service-downloader,TypeScript,Service downloader
ADU,PowerShell,Appliance Diagnostic Utility (ADU) for Analytics Platform System (APS)
advanced-formula-environment,,"Create, edit, and reuse formulas in Excel"
advanced-github-copilot,,Advanced techniques and patterns to use GitHub Copilot in challenging codebases
Advanced-Threat-Analytics,PowerShell,ATA PowerShell Module
advancedsecurity,,
AdventureWorksSkiApp,C#,The AdventureWorks Ski App provides a sample application that can be used to demonstrate the value of building in intelligence into an existing application. This app was first demoed at //build 2016.
Adversarial-Chatter,Jupyter Notebook,
AdversarialGMM,Python,Minimax Estimation of Conditional Moment Models
advNLG,Python,
AdvocacyPlatform,C#,"The Advocacy Platform is a cloud solution to automate the acquisition of case decisions, court hearings and location information from the EOIR hotline. Additionally, this solution helps NGOs working with Asylum seeker families at risk of deportation to allocate legal professionals/volunteers more efficiently."
adx-automotive-demos,Python,Demos 
adx-query-charts,TypeScript,Draw charts from Azure Data Explorer queries
AEC-Challenge,,AEC Challenge
aed-blockchain-learn-content,,Beta content for blockchain Learn modules
aed-content-nasa-su20,Jupyter Notebook,This is the beta content for the learn modules that we are creating for NASA for 2020 internship
aed-external-learn-template,,Template for creating Learn modules and Learning Paths
aed-go-learn-content,,
aed-learn-template,,
aed-rust-learn-content,,Rust learning path content development repo.
aed-wonder-woman,Python,
aerial_wildlife_detection,Python,Tools for detecting wildlife in aerial images using active learning
affectbased,Python,Affect-based Intrinsic Rewards for Learning General Representations: https://arxiv.org/abs/1912.00403
AFUN-Demos,HTML,Demos for AFUN content for Microsoft Ignite the Tour content 
agdebugger,TypeScript,
agdiag,C#,"Diagnose AlwaysOn health events like failover events, and failure to failover events"
agent-academy,PowerShell,Curated lessons on getting started building agents with Copilot Studio
Agent-Christine,,Build your own agent for Marketplace assistance
Agent-for-Contract-Processing-Solution-Accelerator,,"Solution Accelerator to show how to deploy an Agent configured in Copilot Studio to streamline NDA document creation, management and signing."
agent-for-hr-service-solution-accelerator,HTML,"This solution streamlines HR service workflows with an AI-powered assistant that delivers instant answers, automates record updates, and provides intelligent support, saving time and elevating the employee experience."
agent-for-rfp-response-solution-accelerator,,
agent-forge,TypeScript,"AGENT-FORGE is a Context Engineering Toolkit that generates GitHub Copilot customization files for your VS Code project. Instead of manually authoring .github/ configuration, you describe what you need and a multi-agent AI pipeline plans, generates, validates, and installs everything."
agent-framework,Python,"A framework for building, orchestrating and deploying AI agents and multi-agent workflows with support for Python and .NET."
Agent-Framework-Samples,Jupyter Notebook,Agent Framework Samples  - showcasing ways in which agent framework can be utilized.
agent-governance-toolkit,Python,"AI Agent Governance Toolkit — Policy enforcement, zero-trust identity, execution sandboxing, and reliability engineering for autonomous AI agents. Covers 10/10 OWASP Agentic Top 10."
agent-lightning,Python,The absolute trainer to light up AI agents.
agent-resources,HTML,Resources to help enterprises turn into frontier firms through agentic transformation
agent-sessions-day,,A repo holding any content for Agent Sessions Day
Agent365-devTools,C#,"The Microsoft Agent 365 DevTools CLI is a command-line interface tool designed to streamline the development, deployment, and management of Microsoft Agent 365 applications."
Agent365-dotnet,C#,
Agent365-nodejs,TypeScript,
Agent365-python,Python,
Agent365-Python-AI-First,Python,
agent365-resources,HTML,Resources for Microsoft Agent 365
Agent365-Samples,Python,
AgentAsJudge,Python,An agentic evaluation framework
agenthonseoul2025,SCSS,
agentic-ai-lab,Jupyter Notebook,Azure AI Foundry & Agents Workshop
agentic-ai-lab-dotnet,Jupyter Notebook,End-to-End Azure AI Foundry And Agents Development Laboratory
agentic-applications-for-unified-data-foundation-solution-accelerator,TSQL,"This accelerator unifies enterprise data with Microsoft Fabric and applies agentic AI to enable faster, smarter decisions. With Microsoft Foundry agents and the Microsoft Agent Framework orchestration, teams can automate workflows, query data in natural language, and uncover insights that fuel agility, collaboration, and innovation."
agentic-devops-sample,,agentic devops sample
agentic-factory-hack,Python,"Build AI-powered predictive maintenance orchestration with Microsoft Foundry, multi-agent workflows, and MCP"
agentic-sdlc-starter,Shell," Reference architecture for spec-driven, AI-assisted software development using GitHub Copilot, MCP, and repo-based context engineering."
AgenticCookBook,Python,The “Agentic Cookbook for Generative AI Agent usage” is a comprehensive guide designed to empower users with the knowledge and tools to effectively implement and utilize Generative AI Agents within their workflows.
agentrc,TypeScript,Get your repo ready for AI.
agentrl,Python,
AgentRx,Python,
Agents,PowerShell,"The Microsoft 365 Agent SDK simplifies building full stack, multichannel, trusted agents for platforms including M365, Teams, Copilot Studio, and Webchat."
Agents-for-Enhanced-Customer-Care-Solution-Accelerator,,Solution Accelerator to show how to deploy an Agent configured in a voice channel to streamline contact center operations.
Agents-for-js,TypeScript,This repository is for active development of the Microsoft 365 Agent SDK components for JavaScript
Agents-for-net,C#,This repository is for active development of the Microsoft 365 Agent SDK components for .NET
Agents-for-python,Python,This repository is for active development of the Microsoft 365 Agent SDK components for Python
agents-humanoversight,Python,Human Oversight for Autonomous AI Agents using Azure Logic Apps + Python
Agents-M365Copilot,C#,Microsoft 365 Copilot APIs Client Libraries
AgentSchema,TypeScript,Declarative Agent Schema
AgentsClientSDK.Android,,Agents ClientSDK Android repository for Sample apps and releases
AgentsClientSDK.iOS,,Agents ClientSDK iOS repository for Sample apps and releases
AgentsClientSDK.Windows,C#,Agents ClientSDK Windows repository for Sample apps and releases
agentsleague,,"A high-energy developer challenge that brings an e-sports twist to agentic AI with live AI Battles,  asynchronous community challenges, GitHub-based submissions and more!"
agentsleague-techconnect,Python,"Agents League is a fast-paced internal developer challenge with an e-sports mindset, centered around on-site AI battles. Teams build, adapt, and compete in real time, solving agentic AI challenges and submit their projects to win prizes."
AGIC-Installer-assistant,PowerShell,This is a PowerShell script that will guide you through the installation of the AGIC controller for AKS (Brownfield deployment only)
agogosml,Python,agogosml is a flexible data processing pipeline that addresses the common need for operationalizing ML models at scale
ahds-inferno,Ruby,Inferno test suite for Azure Health Data Services FHIR service.
AHS-AppServiceDotNet,JavaScript,Code for SmartHotel 360 Registration app for the AHS
AI,Python,Microsoft AI
ai-agent-eval-scenario-library,,
ai-agent-evals,Python,"Github action to evaluate AI agent applications using model as the judge, content safety and mathematical metrics."
ai-agents-for-beginners,Jupyter Notebook,12 Lessons to Get Started Building AI Agents
ai-at-edge,,Web pages for AI@Edge community
ai-audio-descriptions,TypeScript,
AI-Chat-App-Hack,,"HackTogether: The Microsoft Python Chatbot Hack | Register, Hack, Win"
ai-chat-protocol,TypeScript,A library + API spec for easily streaming generative AI output to your chat applications.
ai-dev-gallery,C#,An open-source project for Windows developers to learn how to add AI with local models and APIs to Windows apps.
ai-developer,TypeScript,This repository contains hackathon challenges for Semantic Kernel.
AI-Developer-Plugin-for-Eclipse,,AI Developer Plugin for Eclipse
ai-discovery-agent,Python,AIDA the AI Discovery Agent and Workshop Facilitator
ai-edu,HTML,"AI education materials for Chinese students, teachers and IT professionals."
AI-For-Beginners,Jupyter Notebook,"12 Weeks, 24 Lessons, AI for All!"
AI-for-Operations-Framework,Python,The purpose of this repository is to provide useful tools for the deployment of an Azure Landing Zone AI ready PoC for Operational purpose with some ready-to-use tools
ai-for-startups-lab,,Workshop for the BASES Challenge at Stanford
ai-freezer-azure,C#,Anomaly detecting scientific freezer monitor using and Adafruit Feather Huzzah32 and Azure Cognitive Services.
ai-freezer-monitor,Jupyter Notebook,ESP32 Temperature monitor designed to work in ULT freezers.
ai-gallery-extension,TypeScript,
AI-Immersion-Workshop,Jupyter Notebook,"Workshop materials from the AI Immersion Workshop, for attendees to access and use"
ai-in-fabric-ai-tour-demos-fy26,,
AI-in-One-Dashboard,PowerShell,AI-in-One Dashboard Power BI template for comprehensive AI usage analytics
AI-in-One-Dashboard-Extended,PowerShell,"Extended AI-in-One Dashboard with Copilot credit consumption, product feedback, and Copilot Studio transcript analytics"
ai-notebooks,Jupyter Notebook,
AI-Pex-for-SDC,,This repository is for Project 'AI-Pex' in Microsoft EPS Asia ISV PSA team. Some guidance and sample codes are provided to build AI SaaS solution in this repository.
ai-powered-notes-winui3-sample,C#,
ai-py-param-validation,Python,Parameter Validation for Python method and function inputs.
AI-Red-Teaming-Playground-Labs,TypeScript,AI Red Teaming playground labs to run AI Red Teaming trainings including infrastructure.
AI-Robot-Challenge-Lab,Python,AI Robot Challenge Lab
ai-school-custom-vision-service-intro,C#,This is an introduction to how to get started using the Custom Vision Service to generate custom models using the web interface and the SDK.
ai-sentry,Python,"AI-Sentry: A lightweight, pluggable facade layer for Azure Open AI, addressing common cross-cutting concerns for enterprise-wide scaling."
AI-System,Python,System for AI Education Resource.
ai-tour-26-zava-diy-dataset-plus-mcp,Python,
ai-utilities,Jupyter Notebook,SAMPLE: Microsoft AI Azure Machine Learning Utilities and Wrappers.
ai.ed,TypeScript,AI for (programming) EDucation
AI2BMD,Python,AI-powered ab initio biomolecular dynamics simulation
ai4eutils,Jupyter Notebook,Shared utility scripts for AI for Earth projects and team members
AI4FluidSimulations,C++,Train large-scale surrogate models for CO2 flow in porous media or for solving the 3D Navier Stokes Equation.
ai4g-flood,HTML,Toolkit for using Microsoft AI for Good team's flood detection model with SAR imagery
ai4s-jobq,Python,"Enables multiple users to push work items to an Azure Queue, while one or more workers pull and process tasks asynchronously."
AIandJS,,
aibast-agents-library,HTML,Main repository for AI BAST Specialist Teal AI Agents Library
aibuilder-labs,,Step-by-step labs for AI Builder & AI prompt use cases
AICentral,C#,"An AI Control Centre for monitoring, authenticating, and providing resilient access to multiple Open AI services. "
aici,Rust,AICI: Prompts as (Wasm) Programs
aicreator,Python,aicreator for aidata
AIDocIntelligence,Python,"AI Document Intelligence is an AI service that applies advanced machine learning to extract text, key-value pairs, tables, and structures from documents automatically and accurately"
AIFluency,,
AIForAccessibility-Samples,JavaScript,"Microsoft's repo for AI for Accessibility prototypes, demos and code samples"
AIforEarth-API-Development,Jupyter Notebook,This is an API Framework for AI models to be hosted locally or on the AI for Earth API Platform (https://github.com/microsoft/AIforEarth-API-Platform).
AIforEarth-API-Platform,Shell,"The AI for Earth API Platform is a distributed infrastructure designed to provide a secure, scalable, and customizable API hosting, designed to handle the needs of long-running/asynchronous machine learning model inference. It is to be used with the AI For Earth API Framework (https://github.com/microsoft/AIforEarth-API-Development)."
AIforEarthDataSets,Jupyter Notebook,Notebooks and documentation for AI-for-Earth-managed datasets on Azure
AIforITOps,C#,Workshop for IT/Ops teams to learn how to manage AI-enabled applications on Microsoft Azure.
aifundamentalbootcamp,Jupyter Notebook,Get Hands-On with AI Apps in the App Innovation Fundamental Bootcamp
aihlsIgnited,,AI-driven solutions for Health & Life Sciences with Azure !
aiida-autocas,Python,AiiDA plugin to perform automatic selection of active spaces for multireference calculations.
aiida-dynamic-workflows,Python,An AiiDA plugin for dynamically defining workflows using Python functions
aiida-nwchemex,Python,AiiDA plugin for NWChemEx
aiida-pyscf,Python,AiiDA plugin for the Python-based Simulations of Chemistry Framework (PySCF)
AIInstitute,HTML,Repository for managing the AI Institute
ailab,C#,"Experience, Learn and Code the latest breakthrough innovations with Microsoft AI"
AImagery,ShaderLab,
AIMFGIgnited,JavaScript,"AI MFG Ignited is a Microsoft-hosted webinar series and sample code repository showcasing real-world Azure AI solutions for the manufacturing industry. Explore hands-on assets, demos, and session materials designed to accelerate AI adoption."
AIOpsLab,Python,"A holistic framework to enable the design, development, and evaluation of autonomous AIOps agents."
aip,,
AirbandData,,
AIReferenceArchitectures,,Official Azure Reference Architectures for AI workloads 
airflow-providers-microsoft-fabric,Python,Repository containing the source code for the Microsoft Fabric provider for Airflow. 
AirSim,C++,"Open source simulator for autonomous vehicles built on Unreal Engine / Unity, from Microsoft AI & Research"
AirSim-Drone-Racing-Lab,Python,"A framework for drone racing research, built on Microsoft AirSim."
AirSim-Drone-Racing-Lab-Source,C++,AirSim source + Envs behind https://github.com/microsoft/AirSim-Drone-Racing-Lab 
AirSim-Drone-Racing-VAE-Imitation,Python,"Code associated with our paper ""Learning Visuomotor Policies for Aerial Navigation Using Cross-Modal Representations"": https://arxiv.org/abs/1909.06993"
AirSim-NeurIPS2019-Drone-Racing,Python,"Drone Racing @ NeurIPS 2019, built on Microsoft AirSim"
AISchoolTutorials,C#,This repository contains the developer tutorials and samples to demonstrate how to create the experiments contained on AI Lab.
aisdkforsapabap,ABAP,AI SDK for SAP ABAP
AISkillsForWindows,,Contains samples for implementing Windows Skills by extending the preview base API and using exsting skill packages
aitk-vscode-copilot-chat,,Copilot Chat extension for VS Code and aitk
aitour-advanced-coding-visual-studio-and-github-copilot,C#,
aitour-ai-agents-theater-session,HTML,Resources and content for a 15-minute theater-style talk on the Azure AI Agent Service
aitour-ai-and-low-code-innovation,,
aitour-ai-apps-with-scalable-database,Jupyter Notebook,
aitour-ai-readiness-with-azure,,
aitour-azure-openai-assistants,Python,
aitour-blueprint-to-transform-business,,
aitour-build-a-copilot-on-azure-ai,,"Workshop ""Build a Retail Copilot Code-First on Azure AI"": attendee and presenter resources."
