repo_name,language,description
azure-boards-split,TypeScript,Split a work item to track work that will continue into the next sprint.
azure-boards-vscode,TypeScript,Azure Boards Extension for Visual Studio Code
azure-carbon-estimator,TypeScript,Azure carbon Estimator is an SDK that integrates with Green Software Foundation's Impact Framework for getting emissions for all your Azure workloads
azure-chat-for-java,Java,"Azure Chat for Java, A simple Java-based photo and video sharing application, supporting Azure services as the backend for authentication, Video, photos and friend requests via the Azure Java SDK"
azure-cli,Python,Azure Command-Line Interface
azure-cli-extensions,Python,Public Repository for Extensions of Azure CLI.
Azure-CloudAdoptionFramework-UnderstandingNetworking,PowerShell,
azure-cloudera-vm-metrics-logging,Shell,Azure Cloudera linux vm metrics logging with fluentd to azure storage
azure-container-apps,Bicep,Roadmap and issues for Azure Container Apps
azure-cookbook,Ruby,Windows Azure Cookbook for Chef
azure-cosmos-db-sampler,Java,An Apache JMeter sampler for load-testing Cosmos DB SQL API accounts
azure-cost-monitor,Python,
azure-data-manager-for-energy-experience-lab,TypeScript,"Experience Lab is a set of utilities that assist in creating instances of Microsoft Azure Data Manager for Energy, performing data loads, and performing basic management operations."
azure-data-manager-for-energy-power-bi-connector,,Microsoft Azure Data Manager for Energy Certified Power BI Connector
azure-data-services-go-fast-capability-assessment,,Document repository that aims to provide a methodology for assessing an organisation's data and analytics platform maturity.
azure-data-services-go-fast-documentation,,Documentation for the Azure Data Services Go Fast Framework. A framework for rapid deployment and configuration of common Azure Data Services Architectures.
azure-databases-aspire,C#,
Azure-Databases-Community-Content,,Microsoft Databases content shared with the Community. 
Azure-Databricks-NYC-Taxi-Workshop,Scala,An Azure Databricks workshop leveraging the New York Taxi and Limousine Commission Trip Records dataset
Azure-Databricks-Solution-Accelerator-Financial-Analytics-Customer-Revenue-Growth-Factor,Python,
azure-databricks-sql-workshop-ja,Python,A repository for managing workshop contents for learning Microsoft Azure's data analytics platform with a focus on Databricks SQL and Synapse Pipeline & Data Flow. The contents are written in Japanese.
Azure-Datahub-Solution-Accelerator-for-Government-Recovery-Programs,Jupyter Notebook,
Azure-DCAP-Client,C++,Interfaces between SGX SDKs and the Azure Attestation SGX Certification Cache.
Azure-DDP,PowerShell,"Framework to build general purpose distributed data platform in Azure Virtual Machines to support various platforms like Hadoop, Cassandra and MongoDB.  "
azure-dev-day,C#,Labs and information for Azure Dev Day.
azure-dev-day-java,HTML,Labs and information for Azure Dev Day.
azure-dev-experience--azure-devbox,Python,Azure Developer experience - using Azure DevBox as a primary environment for Azure development.
Azure-Dev-Experience-developer-environment-options,Python,Summary of developer (development) environment options for developing Azure based solutions.
azure-devops-analytics,TSQL,
azure-devops-auth-samples,JavaScript,Samples showing how to auth with Azure DevOps
azure-devops-dotnet-samples,C#,.NET/C# samples for integrating with Azure DevOps Services and Azure DevOps Server
azure-devops-engineering-extensions,TypeScript,AzureDevOps marketplace extension that contains various engineering oriented Pipeline tasks
azure-devops-extension-add-fields-with-refname,JavaScript,Azure DevOps Extension that can be used to create new fields in a process and allows you to specify the refname
azure-devops-extension-api,TypeScript,REST client libraries and contracts for Azure DevOps web extension developers.
azure-devops-extension-cascading-picklist,TypeScript,Azure DevOps extension to enable cascading picklists on the work item form
azure-devops-extension-hot-reload-and-debug,TypeScript,Azure DevOps extension sample that uses hot reloading and is debuggable directly in VS Code
azure-devops-extension-sample,TypeScript,Sample web extension for Azure DevOps
azure-devops-extension-sdk,TypeScript,Client SDK for developing Azure DevOps extensions
azure-devops-extension-tasks,TypeScript,Pipeline tasks for Azure DevOps Extensions
azure-devops-extension-yeoman-generator,TypeScript,Generates a basic Azure DevOps extension with support for hot reload and debugging in VS Code
azure-devops-go-api,Go,This repository contains Go APIs for interacting with and managing Azure DevOps.
azure-devops-intellij,Java,IntelliJ IDEA plug-in for Visual Studio Team Services and Team Foundation Server (TFS)
azure-devops-mcp,TypeScript,"The MCP server for Azure DevOps, bringing the power of Azure DevOps directly to your agents."
azure-devops-mcp-pr-filter,,"The MCP server for Azure DevOps, bringing the power of Azure DevOps directly to your agents."
azure-devops-node-api,TypeScript,Azure DevOps Client for Node.js
azure-devops-python-api,Python,Azure DevOps Python API
azure-devops-python-samples,Python,Python samples for interacting with and managing Azure DevOps
azure-devops-rust-api,Rust,Rust API crate for the Azure DevOps API
azure-devops-skills,,Sample skills and prompt patterns demonstrating how to use the Azure DevOps MCP Server with GitHub Copilot and agent-based workflows
azure-devops-symbols,TypeScript,Collection of tools for javascript projects to support sourcemap storage using azure devops' symbol service
azure-devops-tls12,PowerShell,Azure DevOps TLS 1.2 transition readiness checker
azure-devops-ui-public,,
azure-devops-wit-client-om-migration-guide,C#,.NET/C# samples for interacting with work items on Azure DevOps Services and Azure DevOps Server
Azure-DevOps-YAML-for-Unity,,A sample yaml configuration for creating a headless pipeline to build Unity3D projects for HoloLens2 with Azure Pipelines and Microsoft Hosted Agents.
azure-digital-twins-code-samples,,Azure Digital Twins Code Samples
azure-digital-twins-java,Java,Azure Digital Twins - Java Support Collection
azure-digital-twins-postman-samples,,Azure Digital Twins Postman Samples
Azure-Edge-Solutions-Lab,Python,"Edge AI end to end solution using AzSHCI, AKS, and ARC"
Azure-Employee-Network-Graph-Solution-Accelerator-with-MGDC,Jupyter Notebook,
azure-gaming-devops,,DevOps Pipelines for Azure Gaming Services
azure-genai-design-patterns,Python,
azure-gradle-plugins,Java,Azure Plugins for Gradle
azure-grpc-telemetry-pipeline,HCL,A sample pipeline to ingest and process gRPC telemetry data
azure-health-AI-services-samples,,"This repository contains different samples applications and sample code to help you get started with the different Health-AI services. Based on these you will learn how to use our products, and accelerate your implementations."
azure-health-data-services-toolkit,C#,Customization model for Azure Health Data Services.
azure-health-data-services-workshop,Bicep,Repository for instructor led and self-paced Azure Health Data Services workshops
azure-iac-agentic-toolkit,Shell,This project combines open-source tools with GitHub Copilot agentic configurations to help you to engineer Azure-based infrastructure with Terraform.
Azure-ILB-hairpin,,Back-end to front-end communication with Azure Internal Load Balancer
Azure-Integration-Reports,,This repo will be used to generate and store reports for other GitHub repos
Azure-Invoice-Process-Automation-Solution-Accelerator,,
azure-iot-central-esp32-sample,C++,"An end-to-end example code to connect an ESP32 board with Azure IoT Central and send temperature, humidity, and light data from sensors."
azure-iot-developer-kit,,A curated list of awesome Azure IoT Developer Kit projects and resources.
azure-iot-edge-cv-model-samples,Python,An end-to-end IoT Edge solution performing object detection (YOLOv3)
azure-iot-edge-jenkins-plugin,Java,A Jenkins plugin for continuous integration(build and push docker image) and continuous deployment(create Edge deployment on Azure)
azure-iot-edge-vsts-extension,JavaScript,A tool for continuous integration(build and push docker image) and continuous deployment(create Edge deployment on Azure)
azure-iothub-exporter,Go,Prometheus exporter for Azure IoT Hub
Azure-Key-Vault-Plugin-gMSA,Smarty,
Azure-Kinect-Samples,C,Samples for Azure Kinect
Azure-Kinect-Sensor-SDK,C++,A cross platform (Linux and Windows) user mode SDK to read data from your Azure Kinect device.
azure-kms,,Key management system based on a confidential ledger
Azure-Lab-Services-Retirement-Scripts,PowerShell,"This repository provides a set of automation scripts to help Azure Lab Services customers efficiently prepare for and complete their service retirement workflows. The scripts are designed to streamline bulk cleanup, resource validation, and deprovisioning tasks, reducing manual effort and simplifying the overall offboarding process."
azure-linux-automation,PowerShell,
azure-linux-dev-tools,Go,
azure-linux-image-tools,Go,
azure-linux-kernel,,Patches for building an Azure-tuned Linux kernel.
azure-load-testing,,
Azure-Managed-Instance-Link,PowerShell,"Githib repository for Azure SQL Managed Instance link. This repository contains instructions, links to documentation and other useful resources, as well as scripts for setup and use of Managed Instance link."
azure-maven-archetypes,Scala,Maven Archetypes for Microsoft Azure Services
azure-maven-plugins,Java,Maven plugins for Azure
azure-media-redactor-visualizer,C#,"After submitting an Analyze pass in the cloud, download the output and use this tool to visualize and preview the output, and help select IDs to select for Redact phase in the cloud."
azure-mobile-apps-with-ionic,JavaScript,Ionic template integrated with Azure mobile app services
azure-monitor-lab,,Azure Monitor Lab Exercises
azure-netapp-files,,Azure NetApp Files
azure-nodejs-logpoints-docs,,Instructions for setting up LogPoints on Azure
Azure-Non-Fungible-Token-Solution-Accelerator,C#,
